[
  {
    "layout_id": "grid_2x2",
    "name": "Balanced Quad (2x2)",
    "category": "Minimalist",
    "canvas": {
      "width": 1080,
      "height": 1350,
      "background_color": "#121214",
      "outer_margin": 24,
      "gutter": 16
    },
    "slots": [
      {
        "slot_index": 0,
        "x": 24,
        "y": 24,
        "width": 508,
        "height": 643,
        "fit_mode": "cover",
        "border_radius": 12
      },
      {
        "slot_index": 1,
        "x": 548,
        "y": 24,
        "width": 508,
        "height": 643,
        "fit_mode": "cover",
        "border_radius": 12
      },
      {
        "slot_index": 2,
        "x": 24,
        "y": 683,
        "width": 508,
        "height": 643,
        "fit_mode": "cover",
        "border_radius": 12
      },
      {
        "slot_index": 3,
        "x": 548,
        "y": 683,
        "width": 508,
        "height": 643,
        "fit_mode": "cover",
        "border_radius": 12
      }
    ],
    "sample_images": [
      "https://images.unsplash.com/photo-1534528741775-53994a69daeb?auto=format&fit=crop&w=1080&q=80",
      "https://images.unsplash.com/photo-1506744038136-46273834b3fb?auto=format&fit=crop&w=1080&q=80",
      "https://images.unsplash.com/photo-1517841905240-472988babdf9?auto=format&fit=crop&w=1080&q=80",
      "https://images.unsplash.com/photo-1524504388940-b1c1722653e1?auto=format&fit=crop&w=1080&q=80"
    ],
    "sample_text": [
      "MOMENTS",
      "Paris, France"
    ]
  },
  {
    "layout_id": "hero_top_3_sub",
    "name": "Hero Header & Triptych (1 Top, 3 Bottom)",
    "category": "Minimalist",
    "canvas": {
      "width": 1080,
      "height": 1350,
      "background_color": "#121214",
      "outer_margin": 24,
      "gutter": 18
    },
    "slots": [
      {
        "slot_index": 0,
        "x": 24,
        "y": 24,
        "width": 1032,
        "height": 830,
        "fit_mode": "cover",
        "border_radius": 16
      },
      {
        "slot_index": 1,
        "x": 24,
        "y": 872,
        "width": 332,
        "height": 454,
        "fit_mode": "cover",
        "border_radius": 12
      },
      {
        "slot_index": 2,
        "x": 374,
        "y": 872,
        "width": 332,
        "height": 454,
        "fit_mode": "cover",
        "border_radius": 12
      },
      {
        "slot_index": 3,
        "x": 724,
        "y": 872,
        "width": 332,
        "height": 454,
        "fit_mode": "cover",
        "border_radius": 12
      }
    ],
    "sample_images": [
      "https://images.unsplash.com/photo-1492691527719-9d1e07e534b4?auto=format&fit=crop&w=1080&q=80",
      "https://images.unsplash.com/photo-1469474968028-56623f02e42e?auto=format&fit=crop&w=1080&q=80",
      "https://images.unsplash.com/photo-1507525428034-b723cf961d3e?auto=format&fit=crop&w=1080&q=80",
      "https://images.unsplash.com/photo-1476514525535-07fb3b4ae5f1?auto=format&fit=crop&w=1080&q=80"
    ],
    "sample_text": [
      "HERO ARCHIVE",
      "Autumn Light Series"
    ]
  },
  {
    "layout_id": "hero_left_3_stacked",
    "name": "Feature Split (1 Left Hero, 3 Right Stack)",
    "category": "Minimalist",
    "canvas": {
      "width": 1080,
      "height": 1350,
      "background_color": "#121214",
      "outer_margin": 24,
      "gutter": 18
    },
    "slots": [
      {
        "slot_index": 0,
        "x": 24,
        "y": 24,
        "width": 640,
        "height": 1302,
        "fit_mode": "cover",
        "border_radius": 16
      },
      {
        "slot_index": 1,
        "x": 682,
        "y": 24,
        "width": 374,
        "height": 422,
        "fit_mode": "cover",
        "border_radius": 12
      },
      {
        "slot_index": 2,
        "x": 682,
        "y": 464,
        "width": 374,
        "height": 422,
        "fit_mode": "cover",
        "border_radius": 12
      },
      {
        "slot_index": 3,
        "x": 682,
        "y": 904,
        "width": 374,
        "height": 422,
        "fit_mode": "cover",
        "border_radius": 12
      }
    ],
    "sample_images": [
      "https://images.unsplash.com/photo-1519741497674-611481863552?auto=format&fit=crop&w=1080&q=80",
      "https://images.unsplash.com/photo-1501785888041-af3ef285b470?auto=format&fit=crop&w=1080&q=80",
      "https://images.unsplash.com/photo-1513694203232-719a280e022f?auto=format&fit=crop&w=1080&q=80",
      "https://images.unsplash.com/photo-1511671782779-c97d3d27a1d4?auto=format&fit=crop&w=1080&q=80"
    ],
    "sample_text": [
      "FEATURE SPLIT",
      "Nocturnal Rhythm"
    ]
  },
  {
    "layout_id": "columns_4",
    "name": "Vertical Editorial Strips (4 Columns)",
    "category": "Minimalist",
    "canvas": {
      "width": 1080,
      "height": 1350,
      "background_color": "#121214",
      "outer_margin": 24,
      "gutter": 16
    },
    "slots": [
      {
        "slot_index": 0,
        "x": 24,
        "y": 24,
        "width": 246,
        "height": 1302,
        "fit_mode": "cover",
        "border_radius": 12
      },
      {
        "slot_index": 1,
        "x": 286,
        "y": 24,
        "width": 246,
        "height": 1302,
        "fit_mode": "cover",
        "border_radius": 12
      },
      {
        "slot_index": 2,
        "x": 548,
        "y": 24,
        "width": 246,
        "height": 1302,
        "fit_mode": "cover",
        "border_radius": 12
      },
      {
        "slot_index": 3,
        "x": 810,
        "y": 24,
        "width": 246,
        "height": 1302,
        "fit_mode": "cover",
        "border_radius": 12
      }
    ],
    "sample_images": [
      "https://images.unsplash.com/photo-1493663284031-b7e3aefcae8e?auto=format&fit=crop&w=1080&q=80",
      "https://images.unsplash.com/photo-1518495973542-4542c06a5843?auto=format&fit=crop&w=1080&q=80",
      "https://images.unsplash.com/photo-1500530855697-b586d89ba3ee?auto=format&fit=crop&w=1080&q=80",
      "https://images.unsplash.com/photo-1470071459604-3b5ec3a7fe05?auto=format&fit=crop&w=1080&q=80"
    ],
    "sample_text": [
      "VERTICAL STRIPS",
      "Series 01"
    ]
  },
  {
    "layout_id": "rows_4",
    "name": "Cinematic Letterbox (4 Rows)",
    "category": "Minimalist",
    "canvas": {
      "width": 1080,
      "height": 1350,
      "background_color": "#121214",
      "outer_margin": 24,
      "gutter": 14
    },
    "slots": [
      {
        "slot_index": 0,
        "x": 24,
        "y": 24,
        "width": 1032,
        "height": 315,
        "fit_mode": "cover",
        "border_radius": 12
      },
      {
        "slot_index": 1,
        "x": 24,
        "y": 353,
        "width": 1032,
        "height": 315,
        "fit_mode": "cover",
        "border_radius": 12
      },
      {
        "slot_index": 2,
        "x": 24,
        "y": 682,
        "width": 1032,
        "height": 315,
        "fit_mode": "cover",
        "border_radius": 12
      },
      {
        "slot_index": 3,
        "x": 24,
        "y": 1011,
        "width": 1032,
        "height": 315,
        "fit_mode": "cover",
        "border_radius": 12
      }
    ],
    "sample_images": [
      "https://images.unsplash.com/photo-1517841905240-472988babdf9?auto=format&fit=crop&w=1080&q=80",
      "https://images.unsplash.com/photo-1524504388940-b1c1722653e1?auto=format&fit=crop&w=1080&q=80",
      "https://images.unsplash.com/photo-1492691527719-9d1e07e534b4?auto=format&fit=crop&w=1080&q=80",
      "https://images.unsplash.com/photo-1469474968028-56623f02e42e?auto=format&fit=crop&w=1080&q=80"
    ],
    "sample_text": [
      "LETTERBOX 4-STACK",
      "24 FPS KODAK"
    ]
  },
  {
    "layout_id": "minimalist_grid_2x2_v1",
    "name": "Minimalist Quad Grid 1",
    "category": "Minimalist",
    "canvas": {
      "width": 1080,
      "height": 1350,
      "background_color": "#121214",
      "outer_margin": 16,
      "gutter": 12
    },
    "slots": [
      {
        "slot_index": 0,
        "x": 16,
        "y": 16,
        "width": 518,
        "height": 653,
        "fit_mode": "cover",
        "border_radius": 8
      },
      {
        "slot_index": 1,
        "x": 546,
        "y": 16,
        "width": 518,
        "height": 653,
        "fit_mode": "cover",
        "border_radius": 8
      },
      {
        "slot_index": 2,
        "x": 16,
        "y": 681,
        "width": 518,
        "height": 653,
        "fit_mode": "cover",
        "border_radius": 8
      },
      {
        "slot_index": 3,
        "x": 546,
        "y": 681,
        "width": 518,
        "height": 653,
        "fit_mode": "cover",
        "border_radius": 8
      }
    ],
    "sample_images": [
      "https://images.unsplash.com/photo-1534528741775-53994a69daeb?auto=format&fit=crop&w=1080&q=80",
      "https://images.unsplash.com/photo-1506744038136-46273834b3fb?auto=format&fit=crop&w=1080&q=80",
      "https://images.unsplash.com/photo-1517841905240-472988babdf9?auto=format&fit=crop&w=1080&q=80",
      "https://images.unsplash.com/photo-1524504388940-b1c1722653e1?auto=format&fit=crop&w=1080&q=80"
    ],
    "sample_text": [
      "MOMENTS",
      "Paris, France"
    ]
  },
  {
    "layout_id": "minimalist_grid_2x2_v2",
    "name": "Minimalist Quad Grid 2",
    "category": "Minimalist",
    "canvas": {
      "width": 1080,
      "height": 1350,
      "background_color": "#09090b",
      "outer_margin": 20,
      "gutter": 16
    },
    "slots": [
      {
        "slot_index": 0,
        "x": 20,
        "y": 20,
        "width": 512,
        "height": 647,
        "fit_mode": "cover",
        "border_radius": 18
      },
      {
        "slot_index": 1,
        "x": 548,
        "y": 20,
        "width": 512,
        "height": 647,
        "fit_mode": "cover",
        "border_radius": 18
      },
      {
        "slot_index": 2,
        "x": 20,
        "y": 683,
        "width": 512,
        "height": 647,
        "fit_mode": "cover",
        "border_radius": 18
      },
      {
        "slot_index": 3,
        "x": 548,
        "y": 683,